{
  "schema_version": 1,
  "set_id": "demo0001",
  "account": "deskreset",
  "platform": "instagram",
  "language": "ko",
  "canvas": {
    "width": 1080,
    "height": 1350,
    "safe_margin_px": 92
  },
  "fonts_required": [
    {
      "family": "Pretendard",
      "style": "ExtraBold",
      "file": "04_reference/fonts/Pretendard-ExtraBold.woff2"
    },
    {
      "family": "Pretendard",
      "style": "Regular",
      "file": "04_reference/fonts/Pretendard-Regular.woff2"
    },
    {
      "family": "Pretendard",
      "style": "Bold",
      "file": "04_reference/fonts/Pretendard-Bold.woff2"
    }
  ],
  "slides": [
    {
      "index": 1,
      "role": "hook",
      "layout_template": "hook",
      "background_url": "backgrounds/bg_01.png",
      "background_fill": null,
      "overlay": {
        "type": "gradient",
        "opacity": 0.72,
        "color": "#111111"
      },
      "copy_blocks": [
        {
          "id": "s01_eyebrow",
          "role": "eyebrow",
          "text": "DESK RESET",
          "x": 92,
          "y": 725.47,
          "width": 896,
          "height": 39.3,
          "align": "left",
          "color": "#f4f1ec",
          "font": {
            "family": "Pretendard",
            "style": "Bold",
            "size": 28.08,
            "letter_spacing": 0.06,
            "line_height": 1.4
          },
          "line_boxes": [
            {
              "text": "DESK RESET",
              "x": 92,
              "y": 727.47,
              "width": 182.39,
              "height": 34,
              "baseline": 754.47
            }
          ]
        },
        {
          "id": "s01_headline",
          "role": "headline",
          "text": "집중이 끊기는 건\n의지가 아니라 책상 탓이에요",
          "x": 92,
          "y": 805.77,
          "width": 896,
          "height": 324.94,
          "align": "left",
          "color": "#f4f1ec",
          "font": {
            "family": "Pretendard",
            "style": "ExtraBold",
            "size": 91.8,
            "letter_spacing": -0.03,
            "line_height": 1.18
          },
          "line_boxes": [
            {
              "text": "집중이 끊기는 건",
              "x": 92,
              "y": 804.77,
              "width": 571.62,
              "height": 109,
              "baseline": 890.77
            },
            {
              "text": "의지가 아니라 책상",
              "x": 92,
              "y": 913.08,
              "width": 648.22,
              "height": 109,
              "baseline": 999.08
            },
            {
              "text": "탓이에요",
              "x": 92,
              "y": 1021.39,
              "width": 306.34,
              "height": 109,
              "baseline": 1107.39
            }
          ],
          "emphasis_spans": [
            [
              10,
              12
            ]
          ],
          "emphasis_color": "#c8a15a"
        },
        {
          "id": "s01_subhead",
          "role": "subhead",
          "text": "오늘 저녁에 끝낼 수 있는 9가지",
          "x": 92,
          "y": 1218.7,
          "width": 896,
          "height": 39.3,
          "align": "left",
          "color": "#f4f1ec",
          "font": {
            "family": "Pretendard",
            "style": "Bold",
            "size": 28.08,
            "letter_spacing": 0.06,
            "line_height": 1.4
          },
          "line_boxes": [
            {
              "text": "오늘 저녁에 끝낼 수 있는 9가지",
              "x": 92,
              "y": 1220.7,
              "width": 371.94,
              "height": 34,
              "baseline": 1247.7
            }
          ]
        }
      ]
    },
    {
      "index": 2,
      "role": "context",
      "layout_template": "point",
      "background_url": "backgrounds/bg_02.png",
      "background_fill": null,
      "overlay": {
        "type": "gradient",
        "opacity": 0.72,
        "color": "#111111"
      },
      "copy_blocks": [
        {
          "id": "s02_badge",
          "role": "badge",
          "text": "왜",
          "x": 118,
          "y": 785.14,
          "width": 25.95,
          "height": 39.3,
          "align": "left",
          "color": "#f4f1ec",
          "font": {
            "family": "Pretendard",
            "style": "Bold",
            "size": 28.08,
            "letter_spacing": 0.06,
            "line_height": 1.4
          },
          "line_boxes": [
            {
              "text": "왜",
              "x": 118,
              "y": 787.14,
              "width": 25.95,
              "height": 34,
              "baseline": 814.14
            }
          ]
        },
        {
          "id": "s02_headline",
          "role": "headline",
          "text": "손이 먼저 멈추는\n지점을 찾으세요",
          "x": 92,
          "y": 861.44,
          "width": 896,
          "height": 216.62,
          "align": "left",
          "color": "#f4f1ec",
          "font": {
            "family": "Pretendard",
            "style": "ExtraBold",
            "size": 91.8,
            "letter_spacing": -0.03,
            "line_height": 1.18
          },
          "line_boxes": [
            {
              "text": "손이 먼저 멈추는",
              "x": 92,
              "y": 860.44,
              "width": 571.62,
              "height": 109,
              "baseline": 946.44
            },
            {
              "text": "지점을 찾으세요",
              "x": 92,
              "y": 968.75,
              "width": 553.86,
              "height": 109,
              "baseline": 1054.75
            }
          ]
        },
        {
          "id": "s02_body",
          "role": "body",
          "text": "앉아서 일을 시작하기까지 몇 번 손이 멈추는지 세어보세요.\n그 지점이 전부 고칠 곳이에요.",
          "x": 92,
          "y": 1132.06,
          "width": 896,
          "height": 125.94,
          "align": "left",
          "color": "#f4f1ec",
          "font": {
            "family": "Pretendard",
            "style": "Regular",
            "size": 38.88,
            "letter_spacing": -0.01,
            "line_height": 1.62
          },
          "line_boxes": [
            {
              "text": "앉아서 일을 시작하기까지 몇 번 손이 멈추는지 세어보세요.",
              "x": 92,
              "y": 1140.06,
              "width": 872.09,
              "height": 46,
              "baseline": 1176.06
            },
            {
              "text": "그 지점이 전부 고칠 곳이에요.",
              "x": 92,
              "y": 1203.03,
              "width": 445.47,
              "height": 46,
              "baseline": 1239.03
            }
          ]
        }
      ]
    },
    {
      "index": 3,
      "role": "point",
      "layout_template": "point",
      "background_url": "backgrounds/bg_03.png",
      "background_fill": null,
      "overlay": {
        "type": "gradient",
        "opacity": 0.72,
        "color": "#111111"
      },
      "copy_blocks": [
        {
          "id": "s03_badge",
          "role": "badge",
          "text": "01",
          "x": 118,
          "y": 785.14,
          "width": 35.08,
          "height": 39.3,
          "align": "left",
          "color": "#f4f1ec",
          "font": {
            "family": "Pretendard",
            "style": "Bold",
            "size": 28.08,
            "letter_spacing": 0.06,
            "line_height": 1.4
          },
          "line_boxes": [
            {
              "text": "01",
              "x": 118,
              "y": 787.14,
              "width": 35.08,
              "height": 34,
              "baseline": 814.14
            }
          ]
        },
        {
          "id": "s03_headline",
          "role": "headline",
          "text": "모니터는\n눈높이보다 살짝 아래",
          "x": 92,
          "y": 861.44,
          "width": 896,
          "height": 216.62,
          "align": "left",
          "color": "#f4f1ec",
          "font": {
            "family": "Pretendard",
            "style": "ExtraBold",
            "size": 91.8,
            "letter_spacing": -0.03,
            "line_height": 1.18
          },
          "line_boxes": [
            {
              "text": "모니터는",
              "x": 92,
              "y": 860.44,
              "width": 306.34,
              "height": 109,
              "baseline": 946.44
            },
            {
              "text": "눈높이보다 살짝 아래",
              "x": 92,
              "y": 968.75,
              "width": 724.8,
              "height": 109,
              "baseline": 1054.75
            }
          ]
        },
        {
          "id": "s03_body",
          "role": "body",
          "text": "화면 상단이 눈높이에 오도록 올리면 목이 앞으로 빠지지 않아요.",
          "x": 92,
          "y": 1132.06,
          "width": 896,
          "height": 125.94,
          "align": "left",
          "color": "#f4f1ec",
          "font": {
            "family": "Pretendard",
            "style": "Regular",
            "size": 38.88,
            "letter_spacing": -0.01,
            "line_height": 1.62
          },
          "line_boxes": [
            {
              "text": "화면 상단이 눈높이에 오도록 올리면 목이 앞으로 빠지지",
              "x": 92,
              "y": 1140.06,
              "width": 829.39,
              "height": 46,
              "baseline": 1176.06
            },
            {
              "text": "않아요.",
              "x": 92,
              "y": 1203.03,
              "width": 109.12,
              "height": 46,
              "baseline": 1239.03
            }
          ]
        }
      ]
    },
    {
      "index": 4,
      "role": "point",
      "layout_template": "point",
      "background_url": "backgrounds/bg_04.png",
      "background_fill": null,
      "overlay": {
        "type": "gradient",
        "opacity": 0.72,
        "color": "#111111"
      },
      "copy_blocks": [
        {
          "id": "s04_badge",
          "role": "badge",
          "text": "02",
          "x": 118,
          "y": 785.14,
          "width": 39.05,
          "height": 39.3,
          "align": "left",
          "color": "#f4f1ec",
          "font": {
            "family": "Pretendard",
            "style": "Bold",